{
  "season": 2026,
  "generated_utc": "2026-10-30T02:38:42Z",
  "weeks_replayed": [
    1,
    2,
    3,
    4,
    5,
    6,
    7
  ],
  "legs": {
    "on_file": 794,
    "locked": 643,
    "unlocked": 151,
    "resolved": 548,
    "unresolved_by_reason": {
      "no_stat_line": 37,
      "push": 6,
      "tie": 1,
      "week_not_resolved": 51
    }
  },
  "baseline": "shipped",
  "variants": {
    "shipped": {
      "description": "The probability locked on the leg at build time. The baseline every other row is measured against; it is not a candidate.",
      "legs": {
        "pooled": {
          "n": 548,
          "hit_rate": 0.5073,
          "log_loss": 0.6742,
          "brier": 0.2407,
          "shipped_log_loss_same_legs": 0.6742,
          "delta_log_loss": 0.0,
          "ci90": [
            0.0,
            0.0
          ],
          "verdict": "same"
        },
        "by_week": [
          {
            "n": 69,
            "hit_rate": 0.4348,
            "log_loss": 0.6729,
            "brier": 0.2404,
            "shipped_log_loss_same_legs": 0.6729,
            "delta_log_loss": 0.0,
            "ci90": [
              0.0,
              0.0
            ],
            "verdict": "same",
            "week": 1
          },
          {
            "n": 90,
            "hit_rate": 0.4889,
            "log_loss": 0.6792,
            "brier": 0.2431,
            "shipped_log_loss_same_legs": 0.6792,
            "delta_log_loss": 0.0,
            "ci90": [
              0.0,
              0.0
            ],
            "verdict": "same",
            "week": 2
          },
          {
            "n": 90,
            "hit_rate": 0.6,
            "log_loss": 0.6866,
            "brier": 0.247,
            "shipped_log_loss_same_legs": 0.6866,
            "delta_log_loss": 0.0,
            "ci90": [
              0.0,
              0.0
            ],
            "verdict": "same",
            "week": 3
          },
          {
            "n": 77,
            "hit_rate": 0.4805,
            "log_loss": 0.6371,
            "brier": 0.2235,
            "shipped_log_loss_same_legs": 0.6371,
            "delta_log_loss": 0.0,
            "ci90": [
              0.0,
              0.0
            ],
            "verdict": "same",
            "week": 4
          },
          {
            "n": 93,
            "hit_rate": 0.4946,
            "log_loss": 0.669,
            "brier": 0.2372,
            "shipped_log_loss_same_legs": 0.669,
            "delta_log_loss": 0.0,
            "ci90": [
              0.0,
              0.0
            ],
            "verdict": "same",
            "week": 5
          },
          {
            "n": 75,
            "hit_rate": 0.52,
            "log_loss": 0.701,
            "brier": 0.2534,
            "shipped_log_loss_same_legs": 0.701,
            "delta_log_loss": 0.0,
            "ci90": [
              0.0,
              0.0
            ],
            "verdict": "same",
            "week": 6
          },
          {
            "n": 54,
            "hit_rate": 0.5185,
            "log_loss": 0.6712,
            "brier": 0.239,
            "shipped_log_loss_same_legs": 0.6712,
            "delta_log_loss": 0.0,
            "ci90": [
              0.0,
              0.0
            ],
            "verdict": "same",
            "week": 7
          }
        ],
        "by_market": {
          "moneyline": {
            "n": 114,
            "hit_rate": 0.5789,
            "log_loss": 0.6705,
            "brier": 0.2394,
            "shipped_log_loss_same_legs": 0.6705,
            "delta_log_loss": 0.0,
            "ci90": [
              0.0,
              0.0
            ],
            "verdict": "same"
          },
          "qb_pass_yds": {
            "n": 98,
            "hit_rate": 0.5306,
            "log_loss": 0.7103,
            "brier": 0.2574,
            "shipped_log_loss_same_legs": 0.7103,
            "delta_log_loss": 0.0,
            "ci90": [
              0.0,
              0.0
            ],
            "verdict": "same"
          },
          "rb_rush_yds": {
            "n": 98,
            "hit_rate": 0.5306,
            "log_loss": 0.6477,
            "brier": 0.2278,
            "shipped_log_loss_same_legs": 0.6477,
            "delta_log_loss": 0.0,
            "ci90": [
              0.0,
              0.0
            ],
            "verdict": "same"
          },
          "spread": {
            "n": 137,
            "hit_rate": 0.3796,
            "log_loss": 0.6931,
            "brier": 0.25,
            "shipped_log_loss_same_legs": 0.6931,
            "delta_log_loss": 0.0,
            "ci90": [
              0.0,
              0.0
            ],
            "verdict": "same"
          },
          "wr_rec_yds": {
            "n": 101,
            "hit_rate": 0.5545,
            "log_loss": 0.6432,
            "brier": 0.2256,
            "shipped_log_loss_same_legs": 0.6432,
            "delta_log_loss": 0.0,
            "ci90": [
              0.0,
              0.0
            ],
            "verdict": "same"
          }
        },
        "skipped_legs": 0,
        "changed_legs": 0
      },
      "parlays": {
        "eligible": 521,
        "excluded_by_reason": {
          "no_stat_line": 27,
          "leg_not_locked": 84,
          "push": 6,
          "tie": 2,
          "week_not_replayed": 60
        },
        "rules": {
          "all": {
            "n": 521,
            "hit": 166,
            "staked": 52100.0,
            "net_fair": 14988.15,
            "net_vig2": 10496.72,
            "roi_fair": 0.2877,
            "roi_vig2": 0.2015,
            "assumed_price_legs": 418
          },
          "ev_gt_0": {
            "n": 257,
            "hit": 73,
            "staked": 25700.0,
            "net_fair": -1748.2,
            "net_vig2": -2725.4,
            "roi_fair": -0.068,
            "roi_vig2": -0.106,
            "assumed_price_legs": 288
          },
          "ev_gt_0.05": {
            "n": 202,
            "hit": 52,
            "staked": 20200.0,
            "net_fair": -2822.92,
            "net_vig2": -3544.82,
            "roi_fair": -0.1397,
            "roi_vig2": -0.1755,
            "assumed_price_legs": 229
          },
          "tier_high_only": {
            "n": 5,
            "hit": 0,
            "staked": 500.0,
            "net_fair": -500.0,
            "net_vig2": -500.0,
            "roi_fair": -1.0,
            "roi_vig2": -1.0,
            "assumed_price_legs": 4
          },
          "max_2_legs": {
            "n": 345,
            "hit": 115,
            "staked": 34500.0,
            "net_fair": 1882.05,
            "net_vig2": 469.29,
            "roi_fair": 0.0546,
            "roi_vig2": 0.0136,
            "assumed_price_legs": 418
          }
        }
      },
      "verdict": null,
      "note": "The baseline. Every other variant's delta and CI is measured against these exact legs."
    },
    "seed": {
      "description": "Pre-calibration pricing: props = seed_prop_prob(p_team), moneyline = p_team, spread = 0.5. The floor the calibrated model had to clear to ship.",
      "legs": {
        "pooled": {
          "n": 548,
          "hit_rate": 0.5073,
          "log_loss": 0.6844,
          "brier": 0.2458,
          "shipped_log_loss_same_legs": 0.6742,
          "delta_log_loss": 0.0102,
          "ci90": [
            -0.0033,
            0.0238
          ],
          "verdict": "same"
        },
        "by_week": [
          {
            "n": 69,
            "hit_rate": 0.4348,
            "log_loss": 0.6897,
            "brier": 0.2483,
            "shipped_log_loss_same_legs": 0.6729,
            "delta_log_loss": 0.0167,
            "ci90": [
              -0.0156,
              0.0481
            ],
            "verdict": "same",
            "week": 1
          },
          {
            "n": 90,
            "hit_rate": 0.4889,
            "log_loss": 0.6891,
            "brier": 0.2481,
            "shipped_log_loss_same_legs": 0.6792,
            "delta_log_loss": 0.0099,
            "ci90": [
              -0.0162,
              0.0368
            ],
            "verdict": "same",
            "week": 2
          },
          {
            "n": 90,
            "hit_rate": 0.6,
            "log_loss": 0.6722,
            "brier": 0.2398,
            "shipped_log_loss_same_legs": 0.6866,
            "delta_log_loss": -0.0144,
            "ci90": [
              -0.0475,
              0.0172
            ],
            "verdict": "same",
            "week": 3
          },
          {
            "n": 77,
            "hit_rate": 0.4805,
            "log_loss": 0.6616,
            "brier": 0.2353,
            "shipped_log_loss_same_legs": 0.6371,
            "delta_log_loss": 0.0245,
            "ci90": [
              -0.0111,
              0.0588
            ],
            "verdict": "same",
            "week": 4
          },
          {
            "n": 93,
            "hit_rate": 0.4946,
            "log_loss": 0.6776,
            "brier": 0.2425,
            "shipped_log_loss_same_legs": 0.669,
            "delta_log_loss": 0.0086,
            "ci90": [
              -0.0315,
              0.0468
            ],
            "verdict": "same",
            "week": 5
          },
          {
            "n": 75,
            "hit_rate": 0.52,
            "log_loss": 0.6922,
            "brier": 0.2492,
            "shipped_log_loss_same_legs": 0.701,
            "delta_log_loss": -0.0088,
            "ci90": [
              -0.0482,
              0.0297
            ],
            "verdict": "same",
            "week": 6
          },
          {
            "n": 54,
            "hit_rate": 0.5185,
            "log_loss": 0.7234,
            "brier": 0.2648,
            "shipped_log_loss_same_legs": 0.6712,
            "delta_log_loss": 0.0522,
            "ci90": [
              0.0124,
              0.0896
            ],
            "verdict": "worse",